{
  "meta": {
    "name": "Bearing documentation",
    "version": 2,
    "source": "User direction 2026-10-22: a complete redesign in the spirit of Linear (dark-first, near-black neutrals, indigo accent, hairline borders, tight display type). Replaces the v1 values in ui/tokens.css.",
    "memorable": "A precise, quiet tool: dark, dense and calm, with one indigo signal for what matters."
  },
  "color": {
    "primitives": {
      "neutral": {
        "0": {
          "oklch": "oklch(99.2% 0.002 275)",
          "hex": "#fcfcfe"
        },
        "50": {
          "oklch": "oklch(97.5% 0.003 275)",
          "hex": "#f6f7f9"
        },
        "100": {
          "oklch": "oklch(95.5% 0.004 275)",
          "hex": "#eff0f3"
        },
        "200": {
          "oklch": "oklch(92.0% 0.005 275)",
          "hex": "#e3e4e8"
        },
        "300": {
          "oklch": "oklch(86.0% 0.006 275)",
          "hex": "#d0d1d5"
        },
        "400": {
          "oklch": "oklch(72.0% 0.008 275)",
          "hex": "#a3a4aa"
        },
        "500": {
          "oklch": "oklch(60.0% 0.010 275)",
          "hex": "#7e8086"
        },
        "600": {
          "oklch": "oklch(50.0% 0.010 275)",
          "hex": "#616369"
        },
        "700": {
          "oklch": "oklch(37.0% 0.010 275)",
          "hex": "#3e3f45"
        },
        "800": {
          "oklch": "oklch(27.0% 0.008 275)",
          "hex": "#25262a"
        },
        "850": {
          "oklch": "oklch(22.5% 0.007 275)",
          "hex": "#1b1c1f"
        },
        "900": {
          "oklch": "oklch(19.0% 0.006 275)",
          "hex": "#131417"
        },
        "950": {
          "oklch": "oklch(16.0% 0.005 275)",
          "hex": "#0d0d0f"
        },
        "1000": {
          "oklch": "oklch(13.5% 0.004 275)",
          "hex": "#08080a"
        }
      },
      "accent": {
        "0": {
          "oklch": "oklch(97.0% 0.014 277)",
          "hex": "#f2f4ff"
        },
        "50": {
          "oklch": "oklch(94.5% 0.025 277)",
          "hex": "#e8ecfe"
        },
        "100": {
          "oklch": "oklch(91.0% 0.040 277)",
          "hex": "#dae0fd"
        },
        "300": {
          "oklch": "oklch(78.0% 0.100 277)",
          "hex": "#a7b2f7"
        },
        "400": {
          "oklch": "oklch(70.0% 0.130 277)",
          "hex": "#8a96ee"
        },
        "500": {
          "oklch": "oklch(56.5% 0.160 277)",
          "hex": "#6168d2"
        },
        "600": {
          "oklch": "oklch(52.0% 0.160 277)",
          "hex": "#555ac2"
        },
        "700": {
          "oklch": "oklch(46.0% 0.145 277)",
          "hex": "#464ba7"
        },
        "800": {
          "oklch": "oklch(36.0% 0.110 277)",
          "hex": "#303475"
        },
        "900": {
          "oklch": "oklch(30.0% 0.085 277)",
          "hex": "#242757"
        },
        "1000": {
          "oklch": "oklch(22.0% 0.060 277)",
          "hex": "#141736"
        }
      },
      "success": {
        "0": {
          "oklch": "oklch(97.0% 0.020 158)",
          "hex": "#ebfaf0"
        },
        "100": {
          "oklch": "oklch(92.0% 0.050 158)",
          "hex": "#caefd8"
        },
        "300": {
          "oklch": "oklch(80.0% 0.120 158)",
          "hex": "#75d5a0"
        },
        "500": {
          "oklch": "oklch(62.0% 0.140 158)",
          "hex": "#169f65"
        },
        "700": {
          "oklch": "oklch(48.0% 0.110 158)",
          "hex": "#077045"
        },
        "900": {
          "oklch": "oklch(30.0% 0.060 158)",
          "hex": "#0c3722"
        },
        "1000": {
          "oklch": "oklch(24.0% 0.045 158)",
          "hex": "#092617"
        }
      },
      "warning": {
        "0": {
          "oklch": "oklch(97.5% 0.018 72)",
          "hex": "#fff5ea"
        },
        "100": {
          "oklch": "oklch(93.0% 0.050 72)",
          "hex": "#fde3c4"
        },
        "300": {
          "oklch": "oklch(84.0% 0.120 72)",
          "hex": "#fbbd6e"
        },
        "500": {
          "oklch": "oklch(75.0% 0.150 72)",
          "hex": "#e79c27"
        },
        "700": {
          "oklch": "oklch(52.0% 0.110 72)",
          "hex": "#8f5d04"
        },
        "900": {
          "oklch": "oklch(32.0% 0.060 72)",
          "hex": "#452d0a"
        },
        "1000": {
          "oklch": "oklch(25.0% 0.045 72)",
          "hex": "#2f1e06"
        }
      },
      "danger": {
        "0": {
          "oklch": "oklch(97.0% 0.012 25)",
          "hex": "#fdf2f1"
        },
        "100": {
          "oklch": "oklch(92.0% 0.040 25)",
          "hex": "#fedbd7"
        },
        "300": {
          "oklch": "oklch(78.0% 0.110 25)",
          "hex": "#f69b94"
        },
        "500": {
          "oklch": "oklch(60.0% 0.190 25)",
          "hex": "#db4241"
        },
        "700": {
          "oklch": "oklch(50.0% 0.170 25)",
          "hex": "#b02a2d"
        },
        "900": {
          "oklch": "oklch(30.0% 0.080 25)",
          "hex": "#4f1a18"
        },
        "1000": {
          "oklch": "oklch(24.0% 0.060 25)",
          "hex": "#371210"
        }
      },
      "info": {
        "0": {
          "oklch": "oklch(97.0% 0.015 238)",
          "hex": "#ecf7fe"
        },
        "100": {
          "oklch": "oklch(92.0% 0.040 238)",
          "hex": "#cde9fd"
        },
        "300": {
          "oklch": "oklch(78.0% 0.090 238)",
          "hex": "#7fc0ea"
        },
        "500": {
          "oklch": "oklch(60.0% 0.130 238)",
          "hex": "#0e89c4"
        },
        "700": {
          "oklch": "oklch(50.0% 0.110 238)",
          "hex": "#036b9a"
        },
        "900": {
          "oklch": "oklch(30.0% 0.060 238)",
          "hex": "#083248"
        },
        "1000": {
          "oklch": "oklch(24.0% 0.045 238)",
          "hex": "#062232"
        }
      }
    },
    "roles": {
      "light": {
        "bg": "neutral.0",
        "bg-subtle": "neutral.50",
        "surface": {
          "oklch": "oklch(100.0% 0.000 0)",
          "hex": "#ffffff"
        },
        "surface-raised": {
          "oklch": "oklch(100.0% 0.000 0)",
          "hex": "#ffffff"
        },
        "overlay": {
          "oklch": "oklch(100.0% 0.000 0)",
          "hex": "#ffffff"
        },
        "text": "neutral.950",
        "text-muted": "neutral.600",
        "text-disabled": "neutral.400",
        "link": "accent.600",
        "border": "neutral.200",
        "border-strong": "neutral.500",
        "accent": "accent.500",
        "accent-hover": "accent.600",
        "accent-active": "accent.700",
        "on-accent": {
          "oklch": "oklch(100.0% 0.000 0)",
          "hex": "#ffffff"
        },
        "accent-subtle": "accent.0",
        "success": "success.700",
        "on-success": {
          "oklch": "oklch(100.0% 0.000 0)",
          "hex": "#ffffff"
        },
        "success-subtle": "success.0",
        "warning": "warning.500",
        "on-warning": "neutral.950",
        "warning-subtle": "warning.0",
        "danger": "danger.700",
        "on-danger": {
          "oklch": "oklch(100.0% 0.000 0)",
          "hex": "#ffffff"
        },
        "danger-subtle": "danger.0",
        "info": "info.700",
        "on-info": {
          "oklch": "oklch(100.0% 0.000 0)",
          "hex": "#ffffff"
        },
        "info-subtle": "info.0",
        "focus": "accent.500",
        "selection": "accent.100"
      },
      "dark": {
        "bg": "neutral.1000",
        "bg-subtle": "neutral.950",
        "surface": "neutral.900",
        "surface-raised": "neutral.850",
        "overlay": "neutral.850",
        "text": "neutral.50",
        "text-muted": "neutral.400",
        "text-disabled": "neutral.600",
        "link": "accent.300",
        "border": "neutral.800",
        "border-strong": "neutral.500",
        "accent": "accent.500",
        "accent-hover": "accent.600",
        "accent-active": "accent.700",
        "on-accent": {
          "oklch": "oklch(100.0% 0.000 0)",
          "hex": "#ffffff"
        },
        "accent-subtle": "accent.900",
        "success": "success.300",
        "on-success": "neutral.1000",
        "success-subtle": "success.900",
        "warning": "warning.300",
        "on-warning": "neutral.1000",
        "warning-subtle": "warning.900",
        "danger": "danger.300",
        "on-danger": "neutral.1000",
        "danger-subtle": "danger.900",
        "info": "info.300",
        "on-info": "neutral.1000",
        "info-subtle": "info.900",
        "focus": "accent.400",
        "selection": "accent.800"
      }
    }
  },
  "font": {
    "families": {
      "display": "\"Geist\", ui-sans-serif, system-ui, sans-serif",
      "body": "\"Geist\", ui-sans-serif, system-ui, sans-serif",
      "mono": "\"Geist Mono\", ui-monospace, SFMono-Regular, Menlo, monospace",
      "tenantDisplayFaces": []
    },
    "sizes": {
      "label": 13,
      "body": 15,
      "title": 20,
      "display": 44,
      "hero": 64
    },
    "weights": {
      "regular": 400,
      "emphasis": 510,
      "display": 600
    },
    "lineHeights": {
      "tight": 1.05,
      "snug": 1.3,
      "body": 1.6
    },
    "letterSpacing": {
      "display": "-0.035em",
      "title": "-0.015em",
      "body": "-0.006em",
      "label": "0"
    },
    "roles": {
      "display": {
        "family": "display",
        "size": "display",
        "weight": "display",
        "lineHeight": "tight",
        "tracking": "display"
      },
      "title": {
        "family": "display",
        "size": "title",
        "weight": "display",
        "lineHeight": "snug",
        "tracking": "title"
      },
      "body": {
        "family": "body",
        "size": "body",
        "weight": "regular",
        "lineHeight": "body",
        "tracking": "body"
      },
      "label": {
        "family": "body",
        "size": "label",
        "weight": "emphasis",
        "lineHeight": "snug",
        "tracking": "label"
      },